{
  "schema": "source-item.v1",
  "id": "canvas:file-99999-123456",
  "source": "canvas",
  "external_id": "file-99999-123456",
  "kind": "file",
  "title": "示例课程 · 课程文件：Week 4 Exercise Set.pdf",
  "notes": "📁 Lecture Slides · 512 KB · 上传 2026-09-23 09:10",
  "url": "https://course.example.edu/courses/99999/files/123456",
  "due_at": null,
  "start_at": null,
  "fetched_at": "2026-09-23T10:00:00.000Z",
  "trust": "official",
  "content_hash": "sha256:0000000000000000000000000000000000000000000000000000000000000000",
  "meta": {
    "course_code": "DEMO1010J",
    "course": "示例课程 · 演示用",
    "week": 4,
    "folder": "Lecture Slides"
  },
  "payload": {
    "display_name": "Week 4 Exercise Set.pdf",
    "size": 524288,
    "hidden_for_user": false
  }
}
